<?xml version="1.0" encoding="UTF-8"?>
<configuration xmlns:xsi="http://www.w3.org/2001/XMLSchema-instance"
	xsi:noNamespaceSchemaLocation="config.xsd">
	<mode>dev</mode>
	<adminPassword>admin</adminPassword>
	<database>
		<mode>dev</mode>
		<driver>org.postgresql.Driver</driver>
		<url>jdbc:postgresql://localhost:5432/dev</url>
		<username>anotherglass</username>
		<password>anotherglass</password>
	</database>
	<database>
		<mode>test</mode>
		<driver>org.postgresql.Driver</driver>
		<url>jdbc:postgresql://localhost:5432/test</url>
		<username>anotherglass</username>
		<password>anotherglass</password>
	</database>
	<database>
		<mode>prod</mode>
		<driver>org.postgresql.Driver</driver>
		<url>jdbc:postgresql://localhost:5432/prod</url>
		<username>anotherglass</username>
		<password>anotherglass</password>
	</database>
	<wineApi>
		<url>http://services.wine.com/api/beta2/service.svc/json/</url>
		<key>b77c34d4cc093ccc98977db8e10c7e85</key>
		<fetchSize>300</fetchSize>
		<fetchOffset>66800</fetchOffset>
	</wineApi>
</configuration>